{
  "$schema": "../../../schemas/adapter.schema.json",
  "name": "mikro-orm",
  "axis": "orm",
  "description": "MikroORM adapter — decorator entities, CLI migrations.",
  "augments": ["migrate-orm"],
  "slots": {
    "orm.cheatsheet": "references/cheatsheet.md",
    "orm.migration": "references/migration.md"
  }
}
