{
  "$schema": "../../../schemas/adapter.schema.json",
  "name": "drizzle",
  "axis": "orm",
  "description": "Drizzle ORM adapter — schema-as-code, drizzle-kit migrations.",
  "augments": ["migrate-orm", "data-model-design"],
  "slots": {
    "orm.cheatsheet": "references/cheatsheet.md",
    "orm.migration": "references/migration.md"
  }
}
